{
  "$schema": "http://json-schema.org/draft-07/schema#",
  "$id": "https://architrave-ui/uikit.config.schema.json",
  "title": "Architrave per-repo config",
  "description": "Declares how Architrave retargets its agents, gates, and knowledge for one repo. Lives at the repo root as uikit.config.json. UI is the default lane; the optional backend + iac blocks extend the same judge-gated harness to the service tier and infrastructure (infra is plan-only).",
  "type": "object",
  "required": ["platform", "stack", "designSource", "applyTo", "build", "test"],
  "additionalProperties": false,
  "properties": {
    "platform": {
      "type": "string",
      "description": "Selects the knowledge pack the Platform Design agent loads.",
      "enum": ["apple-macos", "apple-ios", "windows", "web"]
    },
    "stack": {
      "type": "string",
      "description": "UI framework used to implement the design natively.",
      "enum": ["swiftui", "appkit", "winui", "wpf", "maui", "fluent-react", "react", "other"]
    },
    "designSource": {
      "type": "object",
      "description": "Where the canonical design lives (the thing to reproduce, never reinvent).",
      "required": ["type", "path"],
      "additionalProperties": false,
      "properties": {
        "type": { "type": "string", "enum": ["storybook", "swift-ui-lab", "design-doc"] },
        "path": { "type": "string", "description": "Repo-relative path to the design workbench (e.g. src/Admin/.storybook, ui-lab)." },
        "url": { "type": "string", "description": "Optional running/published Storybook URL (e.g. http://localhost:6007 or a gh-pages demo)." },
        "spec": { "type": "string", "description": "Optional repo-relative path to a written design spec (e.g. docs/ui/*-design-spec.md)." },
        "mcp": { "type": "string", "description": "Optional Storybook MCP endpoint from @storybook/addon-mcp (e.g. http://localhost:6006/mcp). When set, agents ground via list-all-documentation/get-documentation, write stories via get-storybook-story-instructions, and preview for sign-off via preview-stories." }
      }
    },
    "designMap": {
      "type": "string",
      "description": "Optional repo-relative path to the component glossary / ui-map (e.g. docs/design/phonodeck-ui-map.json). Source of truth for component names."
    },
    "tokens": {
      "type": "string",
      "description": "Optional repo-relative path to the design tokens file(s) in W3C DTCG format (*.tokens.json). The single source of truth for design<->code reconciliation."
    },
    "tokenBuild": {
      "type": "string",
      "description": "Optional command that regenerates platform code from tokens (e.g. Style Dictionary / Terrazzo). Used by the reconcile gate."
    },
    "knowledgePack": {
      "type": "string",
      "description": "Override which knowledge pack to load. Defaults to the one implied by platform.",
      "enum": ["apple", "microsoft", "web"]
    },
    "applyTo": {
      "type": "array",
      "description": "Globs where the UI lives. Scopes the Architrave UI instructions/agents inside a mixed repo (so the backend lane is untouched).",
      "items": { "type": "string" },
      "minItems": 1
    },
    "build": { "type": "string", "description": "Build command (e.g. 'make build', 'npm run build', 'dotnet build')." },
    "test": { "type": "string", "description": "Test command (e.g. 'make test', 'npx playwright test', 'dotnet test')." },
    "generate": { "type": "string", "description": "Optional pre-build generation step (e.g. 'xcodegen generate')." },
    "screenshot": { "type": "string", "description": "Optional command/recipe that captures a screenshot to compare against the Storybook reference." },
    "backend": {
      "type": "object",
      "description": "Optional service/backend tier. When set, the Architrave harness extends to the backend lane (Service Architect / Backend Planner / Backend Implementer) gated by the same Adversarial Judge. Omit for UI-only repos.",
      "additionalProperties": false,
      "properties": {
        "stack": { "type": "string", "description": "Backend stack.", "enum": ["dotnet", "node", "python", "go", "swift-services", "other"] },
        "solution": { "type": "string", "description": "Repo-relative path to the solution/workspace root the implementer grounds in (e.g. 'src', 'Tessera.slnx')." },
        "architectureDocs": { "type": "array", "description": "Repo-relative paths to the architecture truth the backend agents ground in (ADRs, architecture.md) - the backend's 'designSource'. Reproduce these patterns; never invent parallel abstractions.", "items": { "type": "string" } },
        "contracts": { "type": "string", "description": "Optional repo-relative path to the API/data contracts (OpenAPI, proto, DTOs) - the cross-tier handshake UI and backend both honor." },
        "applyTo": { "type": "array", "description": "Globs where the backend lives (scopes the backend lane).", "items": { "type": "string" } },
        "build": { "type": "string", "description": "Backend build command (e.g. 'dotnet build')." },
        "test": { "type": "string", "description": "Backend test command (e.g. 'dotnet test')." }
      }
    },
    "iac": {
      "type": "object",
      "description": "Optional infrastructure-as-code lane. The Infra Engineer is PLAN-ONLY by charter: it proposes diffs + plan/policy output and NEVER applies - apply stays a human action. Highest-blast-radius lane (secrets, identity, network).",
      "additionalProperties": false,
      "properties": {
        "kind": { "type": "string", "description": "IaC technology.", "enum": ["kubernetes", "bicep", "terraform", "pulumi", "compose", "mixed"] },
        "path": { "type": "string", "description": "Repo-relative path to the IaC (e.g. 'deploy')." },
        "plan": { "type": "string", "description": "Plan/preview command - NEVER apply (e.g. 'kubectl diff -k deploy/k8s', 'az deployment group what-if', 'terraform plan')." },
        "policy": { "type": "string", "description": "Optional policy/lint command (e.g. 'kubeconform', 'tfsec', 'checkov', 'bicep lint')." },
        "applyTo": { "type": "array", "description": "Globs where the IaC lives.", "items": { "type": "string" } }
      }
    }
  }
}
