{
  "platform": "web",
  "stack": "react",
  "designSource": {
    "type": "storybook",
    "path": "src/Sideport.Admin/.storybook",
    "url": "https://dragoshont.github.io/sideport/",
    "mcp": "http://localhost:6006/mcp",
    "spec": "docs/ui/sideport-ui-design-spec.md"
  },
  "knowledgePack": "web",
  "applyTo": ["src/Sideport.Admin/**", "docs/ui/**"],
  "build": "npm --prefix src/Sideport.Admin run build",
  "test": "npm --prefix src/Sideport.Admin run lint",
  "screenshot": "npm --prefix src/Sideport.Admin run test:screens",
  "backend": {
    "stack": "dotnet",
    "solution": "Sideport.slnx",
    "architectureDocs": ["docs"],
    "applyTo": ["src/**", "tests/**"],
    "build": "dotnet build Sideport.slnx",
    "test": "dotnet test Sideport.slnx"
  },
  "iac": {
    "kind": "kubernetes",
    "path": "deploy",
    "plan": "kubectl diff -k deploy/k8s",
    "policy": "kubeconform -summary deploy/k8s",
    "applyTo": ["deploy/**"]
  }
}
